{
  "schema_version": "1.0",
  "id": "pilot-unique-direction",
  "kind": "direction",
  "title": "[UNRANKED PILOT FIXTURE] unique-direction",
  "summary": "Specify a proposed synthetic boundary-sensitivity control with explicit novelty and execution limits.",
  "branch_ids": [],
  "contributors": [
    {
      "github_id": 226906489,
      "github_login": "adequatelimited",
      "roles": [
        "Conceptualization"
      ]
    }
  ],
  "ai_usage": {
    "status": "primarily_generated",
    "tools": [
      {
        "provider": "OpenAI",
        "model_id": "Codex; exact backend version not exposed",
        "model_version": "not exposed",
        "accessed_at": "2026-09-06T23:15:47.009Z",
        "tasks": [
          "Prepared synthetic launch test fixtures"
        ],
        "human_verification": "Operator has not yet completed the contributor pilot."
      },
      {
        "provider": "OpenAI",
        "model_id": "Codex; exact backend version not exposed",
        "model_version": "not exposed",
        "accessed_at": "2026-09-07T04:11:00Z",
        "tasks": [
          "Revised synthetic controls and disclosed limitations for pipeline integration testing"
        ],
        "human_verification": "Operator authorized integration testing; no scientific verification or human review of these proposed controls is asserted."
      }
    ],
    "reproducibility_notes": "Synthetic integration material only; no research result or qualification is asserted."
  },
  "changes": [
    {
      "path": "contributions/pilot-unique-direction/proposal.md",
      "improvement": "Specify a proposed synthetic boundary-sensitivity control with explicit novelty and execution limits."
    }
  ],
  "outcomes": [
    {
      "id": "outcome-pilot-unique-direction",
      "family_id": "family-pilot-boundary-direction",
      "before": "No occupied proposal in the isolated synthetic context.",
      "after": "Specify a proposed synthetic boundary-sensitivity control with explicit novelty and execution limits.",
      "acceptance_test": "Inspect the fixed controls, concentration statistic, character-invariance check, overlap-check step, and explicit no-execution limitation.",
      "evidence": [
        "contributions/pilot-unique-direction/proposal.md"
      ],
      "related_outcomes": [],
      "claimed_cumulative_tier": 2,
      "claimed_incremental_points": 2,
      "claim_rationale": "Synthetic forecast exercise only; not a claim on the live leaderboard.",
      "attribution": [
        {
          "github_id": 226906489,
          "share_basis_points": 10000
        }
      ]
    }
  ],
  "claimed_total_points": 2,
  "rubric_version": "0.1",
  "conflicts": [],
  "limitations": [
    "Synthetic pilot only. Never award competitive points or count this as an outside-contributor pilot."
  ],
  "rights_manifest": "contributions/pilot-unique-direction/rights.md"
}
